{
  "record_id": "01JFJPLHORIZONS3I0001",
  "target": {
    "target_id": "3I_ATLAS",
    "target_type": "object",
    "aliases": [
      "3I/ATLAS",
      "3I ATLAS",
      "C/2025 N1 (ATLAS)"
    ]
  },
  "dataset_role": "ephemeris",
  "priority_profile": "3I_ATLAS_DEFAULT",
  "source": {
    "source_id": "JPL_HORIZONS",
    "source_type": "ephemeris_service",
    "authority_rank": 1,
    "endpoint_id": "horizons_api",
    "url": "https://ssd.jpl.nasa.gov/api/horizons.api",
    "license": "Public Domain",
    "citation": "NASA/JPL Horizons (SSD) â€” Ephemeris service (API)"
  },
  "acquisition": {
    "retrieved_utc": "2025-12-20T22:30:00Z",
    "time_coverage": {
      "start_utc": "2025-12-20T00:00:00Z",
      "end_utc": "2025-12-21T00:00:00Z"
    },
    "facility": {
      "facility_id": "JPL",
      "instrument": "HORIZONS_API",
      "program_id": "N/A"
    }
  },
  "files": [
    {
      "path": "data/raw/JPL_HORIZONS/2025-12-20/3I_ATLAS_horizons_api_ephem.json",
      "media_type": "application/json",
      "role": "primary",
      "size_bytes": 0,
      "sha256": "0000000000000000000000000000000000000000000000000000000000000000"
    }
  ],
  "provenance": {
    "source_query": "GET https://ssd.jpl.nasa.gov/api/horizons.api?format=json&COMMAND=3I%2FATLAS&EPHEM_TYPE=V&CENTER=500%400",
    "upstream_ids": {
      "horizons_command": "3I/ATLAS",
      "ephem_type": "V",
      "center": "500@0",
      "format": "json"
    }
  },
  "integrity": {
    "record_sha256": "0000000000000000000000000000000000000000000000000000000000000000"
  },
  "notes": "Canonical ephemeris raw record (sample) for JPL Horizons API. Placeholder file/checksums until first live fetch is persisted verbatim."
}