{
  "record_id": "01JFTS7Y4Z9Q3M6R8W2A1B0CDE",
  "target": {
    "target_id": "3I_ATLAS",
    "target_type": "object",
    "aliases": ["3I/ATLAS", "3I ATLAS", "3I", "C/2025 N1 (ATLAS)"]
  },
  "dataset_role": "metadata_only",
  "priority_profile": "3I_ATLAS_DEFAULT",
  "source": {
    "source_id": "MPC",
    "source_type": "registry",
    "authority_rank": 1,
    "endpoint_id": "mpc_root",
    "url": "https://minorplanetcenter.net/",
    "license": "Public; attribution required",
    "citation": "Minor Planet Center (MPC), accessed via https://minorplanetcenter.net/ (see provenance.source_query)."
  },
  "acquisition": {
    "retrieved_utc": "2025-12-20T21:00:00Z",
    "time_coverage": {
      "start_utc": "2025-12-20T21:00:00Z",
      "end_utc": "2025-12-20T21:00:00Z"
    },
    "facility": {
      "facility_id": "MPC",
      "instrument": "registry",
      "program_id": "N/A"
    }
  },
  "files": [
    {
      "path": "data/raw/MPC/2025-12-20/mpc_root.html",
      "media_type": "text/html",
      "role": "documentation",
      "size_bytes": 0,
      "sha256": "0000000000000000000000000000000000000000000000000000000000000000"
    }
  ],
  "provenance": {
    "source_query": "GET https://minorplanetcenter.net/ (root landing page; query URLs pinned later)",
    "upstream_ids": {
      "target_canonical": "3I_ATLAS",
      "designation_primary": "3I/ATLAS",
      "designation_cometary": "C/2025 N1 (ATLAS)"
    }
  },
  "integrity": {
    "record_sha256": "0000000000000000000000000000000000000000000000000000000000000000"
  },
  "notes": "Sample record for schema + provenance wiring test. Replace sha256 fields after first real fetch; keep endpoint_id consistent with data/metadata/sources.json."
}